{
  "id": "did:lmx:tool:web-search",
  "type": "Tool",
  "name": "Web Search",
  "version": "0.1.0",
  "status": "active",
  "owner": "open-lmx",
  "created_at": "2026-06-02T00:00:00Z",
  "updated_at": "2026-06-02T00:00:00Z",
  "lifecycle": {
    "state": "active",
    "since": "2026-06-02T00:00:00Z"
  },
  "metadata": {
    "category": "search",
    "capability": "information-retrieval"
  }
}
